{"api_version":"llm.temporal/v1","operation_key":"response-disabled","operation_id":"op-disabled","status":"completed","output":[],"checkpoint":{"handle":"ckp_v1.disabled","parent":null,"kind":"generation","depth":1},"cache":{"disposition":"disabled","variant":0},"cost":{"status":"exact","actual_cost_usd":"0","method":"provider_reported"}}
